{
  "schema_version": "1.0",
  "generated_at": "1970-01-01T00:00:00.000Z",
  "outcome": "BLOCKED_WITH_DECISION_PACKET",
  "reason": "<STOP_CONDITION>",
  "contract_hash": "sha256:0000000000000000000000000000000000000000000000000000000000000000",
  "source_fingerprint": "sha256:0000000000000000000000000000000000000000000000000000000000000000",
  "environment_fingerprint": "sha256:0000000000000000000000000000000000000000000000000000000000000000",
  "findings_fingerprint": "sha256:0000000000000000000000000000000000000000000000000000000000000000",
  "findings_manifest": null,
  "iteration": 0,
  "command_executions": 0,
  "cost_units": 0,
  "elapsed_ms": 0,
  "base_commit": null,
  "scope_violation": null,
  "blockers": [],
  "pending_human_gates": [],
  "blocking_unknowns": [],
  "open_findings": [],
  "required_decisions": [
    "<OWNER_DECISION_REQUIRED>"
  ]
}
